Sheet: Sheet1
A2: Método de Euler en la caída libre
A4: t | B4: Posición | C4: Velocidad | D4: Aceleración
A5: 0 | B5: 10 | C5: 0 | D5: of:=-9.81 -> -9.81
A6: of:=[.A5]+0.1 -> 0.1 | B6: of:=[.B5]+(0.1*[.C5]) -> 10 | C6: of:=[.C5]+(0.1*[.D5]) -> -0.981 | D6: of:=[.D5]+0 -> -9.81
A7: of:=[.A6]+0.1 -> 0.2 | B7: of:=[.B6]+(0.1*[.C6]) -> 9.9019 | C7: of:=[.C6]+(0.1*[.D6]) -> -1.962 | D7: of:=[.D6]+0 -> -9.81
A8: of:=[.A7]+0.1 -> 0.3 | B8: of:=[.B7]+(0.1*[.C7]) -> 9.7057 | C8: of:=[.C7]+(0.1*[.D7]) -> -2.943 | D8: of:=[.D7]+0 -> -9.81
A9: of:=[.A8]+0.1 -> 0.4 | B9: of:=[.B8]+(0.1*[.C8]) -> 9.4114 | C9: of:=[.C8]+(0.1*[.D8]) -> -3.924 | D9: of:=[.D8]+0 -> -9.81
A10: of:=[.A9]+0.1 -> 0.5 | B10: of:=[.B9]+(0.1*[.C9]) -> 9.019 | C10: of:=[.C9]+(0.1*[.D9]) -> -4.905 | D10: of:=[.D9]+0 -> -9.81
A11: of:=[.A10]+0.1 -> 0.6 | B11: of:=[.B10]+(0.1*[.C10]) -> 8.5285 | C11: of:=[.C10]+(0.1*[.D10]) -> -5.886 | D11: of:=[.D10]+0 -> -9.81
A12: of:=[.A11]+0.1 -> 0.7 | B12: of:=[.B11]+(0.1*[.C11]) -> 7.9399 | C12: of:=[.C11]+(0.1*[.D11]) -> -6.867 | D12: of:=[.D11]+0 -> -9.81
A13: of:=[.A12]+0.1 -> 0.8 | B13: of:=[.B12]+(0.1*[.C12]) -> 7.2532 | C13: of:=[.C12]+(0.1*[.D12]) -> -7.848 | D13: of:=[.D12]+0 -> -9.81
A14: of:=[.A13]+0.1 -> 0.9 | B14: of:=[.B13]+(0.1*[.C13]) -> 6.4684 | C14: of:=[.C13]+(0.1*[.D13]) -> -8.829 | D14: of:=[.D13]+0 -> -9.81
A15: of:=[.A14]+0.1 -> 1 | B15: of:=[.B14]+(0.1*[.C14]) -> 5.5855 | C15: of:=[.C14]+(0.1*[.D14]) -> -9.81 | D15: of:=[.D14]+0 -> -9.81
A16: of:=[.A15]+0.1 -> 1.1 | B16: of:=[.B15]+(0.1*[.C15]) -> 4.6045 | C16: of:=[.C15]+(0.1*[.D15]) -> -10.791 | D16: of:=[.D15]+0 -> -9.81
A17: of:=[.A16]+0.1 -> 1.2 | B17: of:=[.B16]+(0.1*[.C16]) -> 3.5254 | C17: of:=[.C16]+(0.1*[.D16]) -> -11.772 | D17: of:=[.D16]+0 -> -9.81
A18: of:=[.A17]+0.1 -> 1.3 | B18: of:=[.B17]+(0.1*[.C17]) -> 2.3482 | C18: of:=[.C17]+(0.1*[.D17]) -> -12.753 | D18: of:=[.D17]+0 -> -9.81
A19: of:=[.A18]+0.1 -> 1.4 | B19: of:=[.B18]+(0.1*[.C18]) -> 1.0729 | C19: of:=[.C18]+(0.1*[.D18]) -> -13.734 | D19: of:=[.D18]+0 -> -9.81